{
  "$schema": "https://folderbase.ai/protocol/0.5/folderbase.schema.json",
  "protocol_version": "0.5.0",
  "folderbase": {
    "id": "folderbase_019f0000-0000-7000-8000-000000000099",
    "name": "Opaque nested fixture",
    "kind": "project",
    "status": "active",
    "created_at": "2026-08-03T00:00:00Z"
  },
  "adapters": [],
  "policies": {
    "availability": "keep_local",
    "structural_changes": "approve",
    "archive": "manual",
    "cloud_sync": "disabled",
    "capture_ignore": {
      "format": "folderbase-capture-ignore-v1",
      "rules": []
    }
  }
}
